{
  "schema_name": "caatuu-game-manifest",
  "schema_version": 2,
  "manifest_version": "2.0.0",
  "id": "fixture-game",
  "version": "1.0.0",
  "release_status": "local-preview-only",
  "interface_locales": ["en"],
  "engine": {
    "name": "godot",
    "version": "4.7.1",
    "renderer": "gl_compatibility",
    "export_preset": "Web",
    "threading": "single"
  },
  "source": {
    "project": "apps/games/fixture-game/project.godot"
  },
  "delivery": {
    "artifact_directory": "artifacts/games/fixture-game/web/v1",
    "public_entrypoint": "/games/fixture-game/v1/index.html",
    "compatibility_entrypoints": []
  },
  "platforms": { "browser": true, "android": false },
  "browser_mode": "standalone",
  "dependencies": [
    {
      "id": "fixture-assets",
      "authority": "assets/fixture-assets/manifest.json",
      "status": "preview-only"
    }
  ],
  "notices": ["apps/games/fixture-game/THIRD_PARTY_NOTICES.md"],
  "commands": { "export": "fixture-export", "validate": "fixture-validate" }
}
